{
  "$schema": "../schemas/registry.schema.json",
  "schema_version": "1",
  "name": "QHub",
  "revision": "20260922061346",
  "repository": "https://github.com/QroleLabs/QHub",
  "plugins": [
    {
      "id": "com.qrole.memory",
      "trust": "official",
      "listed": true,
      "repository_url": "https://github.com/QroleLabs/QHub/tree/main/plugins/com.qrole.memory",
      "releases": [
        {
          "version": "1.0.0",
          "path": "plugins/com.qrole.memory/1.0.0/manifest.json",
          "manifest_hash": "sha256:2d411ee1934f53fe2036241d25d3f884baa9d7e88730e7c709072e921a7f5f2d",
          "published_at": "2026-09-03T06:52:52.134965Z",
          "manifest": {
            "schema_version": "1",
            "id": "com.qrole.memory",
            "name": "长期记忆",
            "version": "1.0.0",
            "description": "按全局、角色或会话保存长期记忆，并在相关对话中安全注入上下文。",
            "category": "记忆与上下文",
            "keywords": [
              "记忆",
              "上下文",
              "角色对话"
            ],
            "author": {
              "name": "QScene"
            },
            "runtime": {
              "type": "memory.v1"
            },
            "permissions": [
              "chat:memory"
            ],
            "compatibility": {
              "platform_api": ">=1.0.0 <2.0.0"
            },
            "config_schema": {
              "type": "object",
              "additionalProperties": false,
              "properties": {
                "top_k": {
                  "type": "integer",
                  "title": "每次注入条数",
                  "description": "每次对话最多选取的相关记忆数量。",
                  "minimum": 1,
                  "maximum": 20,
                  "default": 8
                },
                "max_context_chars": {
                  "type": "integer",
                  "title": "上下文字数上限",
                  "description": "一次请求可注入的长期记忆总字符数。",
                  "minimum": 500,
                  "maximum": 12000,
                  "default": 4000
                }
              }
            }
          }
        }
      ],
      "documentation_url": "https://github.com/QroleLabs/QHub/tree/main/plugins/com.qrole.memory"
    },
    {
      "id": "com.qrole.relationship",
      "trust": "official",
      "listed": true,
      "repository_url": "https://github.com/QroleLabs/QHub/tree/main/plugins/com.qrole.relationship",
      "releases": [
        {
          "version": "1.0.0",
          "path": "plugins/com.qrole.relationship/1.0.0/manifest.json",
          "manifest_hash": "sha256:fe17793d1caf3e703b7b79933daced4437e3cd01657c0dd42265dc9d22174d32",
          "published_at": "2026-09-05T02:52:33.115066Z",
          "manifest": {
            "schema_version": "1",
            "id": "com.qrole.relationship",
            "name": "轻量关系状态",
            "version": "1.0.0",
            "description": "由用户主动维护当前 Persona、角色和剧情分支的称呼、熟悉与交流边界。",
            "category": "记忆与上下文",
            "keywords": [
              "关系",
              "称呼",
              "交流边界",
              "角色对话"
            ],
            "author": {
              "name": "QScene"
            },
            "runtime": {
              "type": "relationship.v1"
            },
            "permissions": [
              "chat:relationship"
            ],
            "compatibility": {
              "platform_api": ">=1.0.0 <2.0.0"
            },
            "config_schema": {
              "type": "object",
              "additionalProperties": false,
              "properties": {
                "max_context_chars": {
                  "type": "integer",
                  "title": "上下文字数上限",
                  "description": "一次对话最多注入的关系状态参考信息。",
                  "minimum": 200,
                  "maximum": 4000,
                  "default": 1200
                }
              }
            }
          }
        }
      ],
      "documentation_url": "https://github.com/QroleLabs/QScene/blob/main/docs/chat-continuity-v1.md"
    },
    {
      "id": "com.qscene.model-preference",
      "trust": "official",
      "listed": true,
      "repository_url": "https://github.com/QroleLabs/QHub/tree/main/plugins/com.qscene.model-preference",
      "documentation_url": "https://github.com/QroleLabs/QHub/tree/main/plugins/com.qscene.model-preference",
      "releases": [
        {
          "version": "1.0.0",
          "path": "plugins/com.qscene.model-preference/1.0.0/manifest.json",
          "manifest_hash": "sha256:62e30d0f283f583e2d1464c97cfe00cd3ea41bc7c91c6b76f8d8215cdef8a9f1",
          "published_at": "2026-09-03T00:00:00Z",
          "manifest": {
            "schema_version": "1",
            "id": "com.qscene.model-preference",
            "name": "自定义渠道模型",
            "version": "1.0.0",
            "description": "选择管理员已开放的渠道模型，作为新建对话的默认模型；对话中的显式选择始终优先。",
            "category": "模型与渠道",
            "keywords": [
              "渠道",
              "模型",
              "默认模型",
              "对话偏好"
            ],
            "author": {
              "name": "QScene"
            },
            "runtime": {
              "type": "model-preference.v1"
            },
            "permissions": [
              "chat:model-preference"
            ],
            "compatibility": {
              "platform_api": ">=1.0.0 <2.0.0"
            },
            "config_schema": {
              "type": "object",
              "additionalProperties": false,
              "properties": {
                "channel_model_id": {
                  "type": "string",
                  "title": "默认渠道模型",
                  "description": "仅可选择已启用并配置积分计费的模型；模型停用后自动回退到平台默认值。",
                  "minLength": 1,
                  "maxLength": 64
                }
              },
              "required": [
                "channel_model_id"
              ]
            }
          }
        }
      ]
    },
    {
      "id": "qscene.character-card-inspector",
      "trust": "official",
      "listed": false,
      "repository_url": "https://github.com/QroleLabs/QScene/tree/main/plugins/official/qscene.character-card-inspector",
      "releases": [
        {
          "version": "1.0.0",
          "path": "plugins/qscene.character-card-inspector/1.0.0/manifest.json",
          "manifest_hash": "sha256:092a217a1a9caa60f0ec2f0a75be57e8ab07dc4fd52ad539142140fd4de15474",
          "published_at": "2026-09-04T04:37:16.534801Z",
          "manifest": {
            "schema_version": "1",
            "id": "qscene.character-card-inspector",
            "name": "Character Card Inspector",
            "version": "1.0.0",
            "description": "检查 Character Card V1/V2/V3、World Book、Regex 和大致 Token 占用。",
            "category": "角色卡工具",
            "keywords": [
              "角色卡",
              "世界书",
              "正则",
              "兼容性"
            ],
            "author": {
              "name": "QroleLabs"
            },
            "repository": "https://github.com/QroleLabs/QScene/tree/main/plugins/official/qscene.character-card-inspector",
            "documentation": "https://github.com/QroleLabs/QScene/tree/main/plugins/official/qscene.character-card-inspector/README.md",
            "license": "MIT",
            "runtime": {
              "type": "internal.python.v1",
              "entrypoint": "plugin:create_plugin"
            },
            "capabilities": [
              "role-card-inspector.v1"
            ],
            "permissions": [
              "role-card:inspect"
            ],
            "compatibility": {
              "platform_api": ">=1.0.0 <2.0.0"
            },
            "config_schema": {
              "type": "object",
              "additionalProperties": false,
              "properties": {
                "token_warning_threshold": {
                  "type": "integer",
                  "title": "Token 警告阈值",
                  "minimum": 500,
                  "maximum": 100000,
                  "default": 8000
                }
              }
            }
          }
        }
      ],
      "documentation_url": "https://github.com/QroleLabs/QScene/tree/main/plugins/official/qscene.character-card-inspector/README.md"
    },
    {
      "id": "qscene.dice-tools",
      "trust": "official",
      "listed": true,
      "repository_url": "https://github.com/QroleLabs/QScene/tree/main/plugins/official/qscene.dice-tools",
      "releases": [
        {
          "version": "1.0.0",
          "path": "plugins/qscene.dice-tools/1.0.0/manifest.json",
          "manifest_hash": "sha256:b3346fe0748c6dabfe2524f8d85ab862f7617a18c9ffe152028f7fb118c130ef",
          "published_at": "2026-09-04T04:37:16.588032Z",
          "manifest": {
            "schema_version": "1",
            "id": "qscene.dice-tools",
            "name": "Dice Tools",
            "version": "1.0.0",
            "description": "在聊天工具栏提供 d6、d20 和 d100 掷骰子动作。",
            "category": "聊天工具",
            "keywords": [
              "骰子",
              "随机",
              "动作"
            ],
            "author": {
              "name": "QroleLabs"
            },
            "repository": "https://github.com/QroleLabs/QScene/tree/main/plugins/official/qscene.dice-tools",
            "documentation": "https://github.com/QroleLabs/QScene/tree/main/plugins/official/qscene.dice-tools/README.md",
            "license": "MIT",
            "runtime": {
              "type": "internal.python.v1",
              "entrypoint": "plugin:create_plugin"
            },
            "capabilities": [
              "chat-action.v1"
            ],
            "permissions": [
              "chat:action"
            ],
            "compatibility": {
              "platform_api": ">=1.0.0 <2.0.0"
            },
            "config_schema": {
              "type": "object",
              "additionalProperties": false,
              "properties": {
                "default_die": {
                  "type": "string",
                  "title": "默认骰子",
                  "enum": [